Gene,Class,MAC phenotype,OMIM,Inheritance,Syndrome/associated phenotype -*,Reference,,ABCB6,non-syndromic,"Microphthalmia, Coloboma of iris, retina and choroid",605452,AD,-,"Wang et al., 2012",,ALDH1A3,non-syndromic,"Microphthalmia, retinal coloboma",600463,AR,-,"Fares-Taie et al., 2013;ÊYahyavi et al., 2013",,ATOH7,non-syndromic,Microphthalmia,609875,AR,Persistent hyperplastic primary vitreous,"Khan et al., 2012",,CRYAA,non-syndromic,"Coloboma of iris, Cataract",123580,AD,-,"Beby et al., 2007",,FZD5,non-syndromic,"Microphthalmia, Coloboma of iris, retina and choroid",601723,AD,-,"Liu et al., 2016",,IPO13,non-syndromic,"Microphthalmia, coloboma of iris, cataract",610411,AR,-,"Huang et al., 2018",,LCP1,non-syndromic,Coloboma of iris and choroid,153430,AD,-,"Rainger et al., 2017",,MAF,non-syndromic,"Coloboma of iris, Cataract",177075,AD,Cataract,"Jamieson et al., 2002",,Mir204,non-syndromic,Coloboma of iris,610942,AD,Retinal dystrophy,"Conte et al., 2015",,PAX6,non-syndromic,"Coloboma of iris, retina, choroid and optic nerve Anophthalmia",607108,AD AR,"Aniridia, Morning glory disc anomaly, PeterÕs Anomaly, Anterior segment dysgenesis, Cataract with late-onset corneal dystrophy, Foveal hypoplasia, Keratitis, Optic nerve hypoplasia.","Azuma et al., 1996;ÊAzuma et al., 2003;ÊGlaser et al., 1994",,RARB,non-syndromic,Microphthalmia,180220,"AR, AD","diaphragmatic hernia, pulmonary hypoplasia, and cardiac defects","Srour et al., 2013",,RAX,non-syndromic,"Microphthalmia, anophthalmia, coloboma of optic nerve",601881,AR,-,"Voronina et al., 2004",,RBP4,non-syndromic,"Microphthalmia, Coloboma of iris, choroid and retina",180250,AD AR,"Retinal dystrophy, comedogenic acne syndrome","Cukras et al., 2012;ÊChou et al., 2015.",,SALL2,non-syndromic,"Microphthalmia, Coloboma of iris, retina and choroid",602219,AR,-,"Kelberman et al., 2014",,SHH,non-syndromic,"Microphthalmia with Coloboma of retina, choroid, iris and retina",600725,AD,Holoprosencephaly,"Schimmenti et al. 2003;ÊNanni et al., 1999",,SIX6,non-syndromic,"Coloboma of iris, choroid and optic nerve",606326,AR,"Optic disc anomalies, macular atrophy and reduces retinal ganglion cell differentiation","Aldahmesh et al., 2013;ÊYariz et al., 2015",,STRA6,non-syndromic,"Microphthalmia, anophthalmia, coloboma",610745,AR,-,"Casey et al., 2011",,TENM3,non-syndromic,"Microphthalmia, iris coloboma",610083,AR,-,"Aldahmesh et al., 2012",,VSX2,non-syndromic,"Microphthalmia, anophthalmia, iris coloboma",142993,AR,cataracts,"Kohn et al., 1988;ÊBar-Yosef et al., 2004",,ACTB,syndromic,Coloboma of iris and retina,102630,AD,"Baraitser-Winter syndrome 1, Dystonia, juvenile-onset","Riviere et al., 2012",,ACTG1,syndromic,Coloboma of iris and choroid,102560,AD,"Baraitser-Winter syndrome 2, Deafness","Riviere et al., 2012",,ALG3,syndromic,Coloboma of iris,608750,AR,"Congenital disorder of glycosylation, type IV (CDGS type IV)","Korner et al., 1999",,ALX1,syndromic,"Microphthalmia, coloboma of iris and eye lid",601527,AR,Frontofacionasal dysostosis,"Uz et al., 2010",,BCOR,syndromic,"Microphthalmia, Coloboma of iris, choroid and optic nerve",300485,XL Recessive,Lenz syndrome,"Ng et al., 2004",,BMP4,syndromic,"Microphthalmia, anophthalmia, coloboma",112262,AD,Orofacial cleft facial dysmorphism,"Bakrania et al., 2008;ÊReis et al., 2011",,BMP7,syndromic,"Microphthalmia, anophthalmia, Coloboma of retina, choroid and optic nerve",112267,AD,"Developmental delay, deafness, scoliosis, and cleft palate","Wyatt et al., 2010",,C12orf57,syndromic,"Coloboma of iris, retina and choroid",615140,AR,Temtamy syndrome,"Temtamy et al., 1996",,CHD7,syndromic,"Coloboma of iris, retina, choroid and optic nerve, eye lid (rarely)",608892,AD,CHARGE syndrome,"Vissers et al., 2004",,CLDN19,syndromic,Pseudo coloboma?,610036,AR,"Hypomagnesemia, renal, with ocular involvement","Khan et al., 2018",,CREBBP,syndromic,"Microphthalmia, coloboma of iris, choroid and retina",600140,AD/del,Rubinstein-T aybi syndrome,"Ge et al., 1995",,CRIM1,syndromic,"Coloboma of iris, retina, choroid and optic nerve",606189,AD,,"Toker et al., 2003",,DPYD,syndromic,"Microphthalmia, coloboma of iris and choroid",612779,AR,Dihydropyrimidine dehydrogenase deficiency,"Van Gennip et al., 1994;ÊMeinsma et al. 1995",,FAT1,syndromic,"Microphthalmia, coloboma of choroid and retina",600976,AR,"Glomerulonephropathy, cutaneous syndactyly","Lahrouchi et al., 2019",,FBN1,syndromic,"Coloboma of lens; rarely iris, retina and optic disk coloboma",134797,AR,Marfan syndrome,"Nemet et al., 2006",,FBN2,syndromic,Coloboma of retina and choroid,612570,AD,Congenitalcontractural arachnodactyly,Bard 1979,,FGFR1,syndromic,"Microphthalmia, anophthalmia, coloboma of iris and eye lid",136350,Somatic Mosaicism,Oculocerebrocutaneous syndrome Encephalocraniocutaneo us lipomatosis,"Prontera et al., 2009",,FGFR2,syndromic,Coloboma of iris,176943,AD,Multiple,"Graul-Neumann et al., 2017",,FLNA,syndromic,"Coloboma of iris, retina and optic nerve",300017,XL Dominant XL Recessive,Multiple,"Robertson et al., 2003",,FOXA2,syndromic,Choroidal coloboma,600288,de novo,"hypopituitarism, hyperinsulinism and endoderm-derived organ abnormalities","Giri et al., 2017",,FOXE3,syndromic,"Microphthalmia, Coloboma of iris, retina and optic disc",601094,"AD, AR","Anterior segment dysgenesis, Cataract, aniridia","Khan et al., 2016",,FREM1,syndromic,"Anophthalmia, microphthalmia and coloboma of upper eyelid",608944,AR,MOTA syndrome,"Marles et al., 1992",,GDF3,syndromic,-,606522,AD,"Klippel-Feil Syndrome3, skeletal anomalies","Ye et al., 2010",,GDF6,syndromic,"Microphthalmia, Coloboma of iris, retina, choroid and optic nerve",601147,AD AR,Klippel-Feil Syndrome1 Leber congenital amaurosis,"Asai-Coakwell et al., 2009",,GJA8,syndromic,"Microphthalmia,",600897,AD,Congenital cataracts,"Ceroni et al., 2019",,HMGB3,syndromic,"Coloboma of iris, retina and choroid",300193,XL,"microcephaly, short stature, and intellectual disability","Scott et al., 2014",,HMX1,syndromic,"Coloboma of iris, retina and choroid",142992,AR,Oculoauricular syndrome,"Schorderet et al., 2008",,IGBP1,syndromic,Coloboma of iris and optic nerve,300139,XL Recessive,"Corpus callosum defect, mental retardation, and micrognathia","Graham et al., 2003",,KCTD1,syndromic,Coloboma of iris and eye lid,613420,AD,Scalp-ear-nipple syndrome (Finlay-Marks syndrome),"Sobreira et al., 2006",,KMT2D,syndromic,"Coloboma of iris, retina, choroid and optic nerve",602113,AD,Kabuki syndrome,"Ming et al., 2003",,LINC00237,syndromic,Coloboma of retina and eye lid,614992,AD,MOMO syndrome,"Moretti-Ferreira et al., 1993",,LRP2,syndromic,Coloboma of iris,600073,AR,Donnai-Barrow syndrome,"Avunduk et al., 2000",,MAB21L2,syndromic,"Anophthalmia, microphthalmia, Coloboma of iris and retina",604357,AD AR,skeletal dysplasia,"Rainger et al., 2014",,MITF,syndromic,"Microphthalmia, coloboma",156845,AR,COMMAD syndrome,"George et al., 2016",,MKS1,syndromic,"Microphthalmia, coloboma of iris",609883,AR,Meckel-Gruber syndrome,"Slaats et al., 2016",,MSX2,syndromic,"Coloboma of iris, retina and choroid",123101,de novoduplication,"Craniosynostosis 2, Parietal foramina 1","Plaisancie et al., 2015",,OTX2,syndromic,Microphthalmia,600037,AD,"Retinal dystrophy, early-onset, with or without pituitary dysfunction","Ragge et al., 2005a",,PACS1,syndromic,Coloboma of iris and optic nerve,615009,de novo(c.607C>T),Schuurs-Hoeijmakers syndrome,"Pefkianaki et al., 2018",,PAX2,syndromic,Coloboma of optic nerve,167409,AD,Papillorenal Syndrome,"Sanyanusin et al., 1995",,PDE6D,syndromic,Coloboma of optic nerve,602676,AR,Joubert syndrome 22,"Thomas et al., 2014",,PIGL,syndromic,Coloboma of retina and choroid,605947,AR,CHIME syndrome,"Ng et al., 2012",,PITX2,syndromic,"Microphthalmia, coloboma of iris",601542,AD,"Rieger syndrome, type1","Ozeki et al., 1999",,POMT1,syndromic,"Microphthalmia, coloboma",607423,AR,W alker-W arburg syndrome,"Beltran-Valero de Bernabe et al., 2002",,PQBP1,syndromic,"Coloboma of retina, choroid and optic disc",300463,XL Recessive,Renpenning syndrome,"Martinez-Garay et al., 2007",,PRR12,syndromic,Coloboma of iris.,616633,de novo(LOF),,"Leduc et al., 2018",,PTCH1,syndromic,Coloboma of iris,601309,AD/Sporadic,"Holoprosencephaly, Basal cell nevus syndrome","Chassaing et al., 2016",,PTPN11,syndromic,"Coloboma of iris, retina and optic nerve",176876,AD,Noonan syndrome,"Lee et al., 1992",,PUF60,syndromic,"Coloboma of iris, retina and choroid",604819,de novo,Verheij syndrome,"Graziano et al., 2017",,RAB3GAP1,syndromic,"Microphthalmia, anophthalmia, coloboma of iris, choroid, retina, optic nerve",602536,AR,Warburg micro syndrome 1,"Aligianis et al., 2005",,RERE,syndromic,Coloboma,605226,de novo,"Neurodevelopmental disorder with or without anomalies of the brain, eye, or heart","Fregeau et al., 2016",,SALL1,syndromic,Coloboma of retina and choroid,602218,AD,Townes-Brocks syndrome,"Botzenhart et al., 2005",,SALL4,syndromic,"Microphthalmia, coloboma of iris, choroid and optic nerve",607343,AD,Duane-radial ray syndrome (Okihiro syndrome; acroreno-ocular syndrome),"Borozdin et al., 2004",,SCLT1,syndromic,Retinochoroideal lacunae of colobomatous,611399,XL,Orofaciodigital syndrome IX,"Gurrieri et al., 1992",,SEMA3E,syndromic,"Coloboma of iris, retina and optic nerve",608166,AD,CHARGE syndrome,"Lalani et al., 2004",,SIX3,syndromic,"Microphthalmia, coloboma of iris, retina, choroid and macula",603714,AD,"Holoprosencephaly2, Schizencephaly","Wallis et al., 1999",,SMOC1,syndromic,"Microphthalmia, Coloboma of retina and limb anomalies",608488,AR,limb anomalies,"Abouzeid et al., 2011;ÊOkada et al., 2011",,SMO,syndromic,"Microphthalmia, coloboma of iris",601500,AD,Curry-Jones syndrome,"Twigg et al., 2016",,SOX2,syndromic,"Anophthalmia, microphthalmia, coloboma of iris, retina and choroid",184429,AD,Optic nerve hypoplasia and abnormalities of the central nervous system,"Fantes et al., 2003;ÊRagge et al., 2005b",,SOX3,syndromic,"Microphthalmia, Coloboma",313430,XL (germline mosaicism),Panhypopituitarism Mental retardation,"Jelsig et al., 2018",,SPINT2,syndromic,Coloboma of optic nerve,605124,AR,Congenital sodium diarrhea,"Hirabayashi et al., 2018",,SRD5A3,syndromic,Coloboma of iris,611715,AR,"Congenital disorder of glycosylation, Kahrizi Syndrome","Cantagrel et al., 2010",,TCOF1,syndromic,"Coloboma of iris, choroid, optic nerve and eye lid",606847,AD,,Treacher Collins Syndrome Collaborative Group (1996),,TFAP2A,syndromic,"Microphthalmia, coloboma of iris, choroid and optic nerve",107580,AD,Branchio oculofacial syndrome,"Milunsky et al., 2008",,TGDS,syndromic,Coloboma of iris,616146,XL recessive,Catel-Manzke syndrome,"Ehmke et al., 2014",,TMEM67,syndromic,"Coloboma of iris, retina and choroid",609884,AR,COACH syndrome,"Verloes et al., 1989",,VAX1,syndromic,Microphthalmia,604294,AR,"small optic nerves, orofacial clefting, agenesis of corpus callosum","Slavotinek et al., 2012",,WDR11,syndromic,Coloboma of iris.,606417,AD,Hypogonadotropic hypogonadism with or without anosmia,"Kim et al., 2010",,WASHC5,syndromic,Coloboma of iris and retina,610657,AR,Ritscher-Schinzel syndrome (3C syndrome),"Leonardi et al., 2001",,YAP1,syndromic,"Coloboma of iris, retina and choroid",606608,AD,"hearing impairment, cleft lip/palate, and/or mental retardation","Williamson et al., 2014",,ZEB2,syndromic,Coloboma of iris and retina,605802,AD,Mowat-Wilson syndrome,"Wakamatsu et al., 2001",,